<?xml version="1.0" encoding="UTF-8"?>
<xs:schema xmlns:xs="http://www.w3.org/2001/XMLSchema">
    <xs:element name="html">
        <xs:complexType>
            <xs:sequence>
                <xs:element name="head" minOccurs="0">
                    <xs:complexType>
                        <xs:sequence>
                            <xs:element name="title" type="xs:string" minOccurs="0" />
                        </xs:sequence>
                    </xs:complexType>
                </xs:element>
                <xs:element name="body" minOccurs="0">
                    <xs:complexType>
                        <xs:choice maxOccurs="unbounded">
                            <xs:element name="h1" type="xs:string" />
                            <xs:element name="h2" type="xs:string" />
                            <xs:element name="p">
                                <xs:complexType mixed="true">
                                    <xs:sequence>
                                        <xs:element name="br" minOccurs="0" maxOccurs="unbounded" />
                                    </xs:sequence>
                                </xs:complexType>
                            </xs:element>
                        </xs:choice>
                    </xs:complexType>
                </xs:element>
            </xs:sequence>
        </xs:complexType>
    </xs:element>
</xs:schema>